<?xml version="1.0" encoding="UTF-8" standalone="yes"?>
<propis xmlns="http://www.parlament.gov.rs/propisi" xmlns:xsi="http://www.w3.org/2001/XMLSchema-instance" naziv="Krivicni zakonik" ID="39f9e8b9-7b41-4c81-98f5-bb39f5f65cb7" xsi:schemaLocation="http://www.parlament.gov.rs/propisi file://home/kristina/Desktop/XMLProj/XML-project/data/propis.xsd">
    <deo naziv="OPSTI">
        <glava broj="I" naslov="OSNOVNE ODREDBE">
            <odeljak redni_broj="1." naziv="DDDD">
                <clan broj="1.">
                    <naslov>Nema kriviï¿½nog dela niti kazne bez zakona</naslov>
                    <opis/>
                    <sadrzaj>
                        <stav id="1">
                            <tacka naziv="1)">
<podtacka naziv="(1)">
    <alineje>- a</alineje>
</podtacka>
                            </tacka>
                        </stav>
                    </sadrzaj>
                </clan>
            </odeljak>
        </glava>
    </deo>
</propis>
