<?xml version="1.0" encoding="UTF-8" standalone="yes"?>
<propis xmlns="http://www.parlament.gov.rs/propisi" xmlns:xsi="http://www.w3.org/2001/XMLSchema-instance" naziv="Krivicni zakonik2" ID="bf1070ff-0f1a-4008-9572-7d25f568b49d" xsi:schemaLocation="http://www.parlament.gov.rs/propisi file:/C:/Users/Mima/Documents/GitHub/XML-project/data/propis.xsd">
    <deo naziv="OPSTI2">
        <glava broj="I" naslov="OSNOVNE ODREDBE2">
            <odeljak redni_broj="1." naziv="DDDD">
                <clan broj="1.">
                    <naslov>Nema kriviï¿½nog dela niti kazne bez zakona</naslov>
                    <opis/>
                    <sadrzaj>
                        <stav id="1">
                            <tacka naziv="1)">
<podtacka naziv="(1)">
    <alineje>- a</alineje>
</podtacka>
                            </tacka>
                        </stav>
                    </sadrzaj>
                </clan>
            </odeljak>
        </glava>
    </deo>
</propis>
